[
  {
    "id": "wd-001",
    "title": "HTML Fundamentals",
    "domain": "web_development",
    "level": "beginner",
    "type": "course",
    "tags": [
      "html",
      "fundamentals"
    ],
    "prerequisites": [],
    "duration_hours": 6,
    "url": "https://www.freecodecamp.org/learn/responsive-web-design/",
    "description": "Learn HTML document structure, semantic tags, forms, and accessibility basics by building real pages."
  },
  {
    "id": "wd-002",
    "title": "CSS Fundamentals",
    "domain": "web_development",
    "level": "beginner",
    "type": "course",
    "tags": [
      "css",
      "fundamentals"
    ],
    "prerequisites": [
      "wd-001"
    ],
    "duration_hours": 8,
    "url": "https://www.freecodecamp.org/learn/responsive-web-design/",
    "description": "Core CSS: selectors, the box model, colors, typography, and layout basics."
  },
  {
    "id": "wd-003",
    "title": "Flexbox and CSS Grid",
    "domain": "web_development",
    "level": "beginner",
    "type": "course",
    "tags": [
      "css",
      "layout"
    ],
    "prerequisites": [
      "wd-002"
    ],
    "duration_hours": 4,
    "url": "https://css-tricks.com/snippets/css/a-guide-to-flexbox/",
    "description": "Master modern CSS layout systems for building responsive, multi-column pages."
  },
  {
    "id": "wd-004",
    "title": "Responsive Web Design",
    "domain": "web_development",
    "level": "beginner",
    "type": "course",
    "tags": [
      "css",
      "responsive",
      "mobile"
    ],
    "prerequisites": [
      "wd-003"
    ],
    "duration_hours": 5,
    "url": "https://www.freecodecamp.org/learn/responsive-web-design/",
    "description": "Media queries, mobile-first design, and fluid layouts that adapt to any screen size."
  },
  {
    "id": "wd-005",
    "title": "Git and GitHub Basics",
    "domain": "web_development",
    "level": "beginner",
    "type": "course",
    "tags": [
      "git",
      "version-control",
      "tools"
    ],
    "prerequisites": [],
    "duration_hours": 3,
    "url": "https://www.freecodecamp.org/news/practical-git-and-github-guide/",
    "description": "Track changes, branch, commit, and collaborate using Git and GitHub \u2014 essential for every developer."
  },
  {
    "id": "wd-006",
    "title": "JavaScript Fundamentals",
    "domain": "web_development",
    "level": "beginner",
    "type": "course",
    "tags": [
      "javascript",
      "fundamentals"
    ],
    "prerequisites": [
      "wd-001"
    ],
    "duration_hours": 10,
    "url": "https://www.freecodecamp.org/learn/javascript-algorithms-and-data-structures/",
    "description": "Variables, functions, loops, arrays, objects, and control flow in JavaScript."
  },
  {
    "id": "wd-007",
    "title": "DOM Manipulation",
    "domain": "web_development",
    "level": "beginner",
    "type": "course",
    "tags": [
      "javascript",
      "dom"
    ],
    "prerequisites": [
      "wd-006"
    ],
    "duration_hours": 4,
    "url": "https://developer.mozilla.org/en-US/docs/Web/API/Document_Object_Model",
    "description": "Select, modify, and respond to events on HTML elements using vanilla JavaScript."
  },
  {
    "id": "wd-008",
    "title": "Browser Developer Tools",
    "domain": "web_development",
    "level": "beginner",
    "type": "article",
    "tags": [
      "debugging",
      "tools"
    ],
    "prerequisites": [
      "wd-006"
    ],
    "duration_hours": 2,
    "url": "https://developer.chrome.com/docs/devtools/",
    "description": "Debug JavaScript, inspect the DOM, and profile performance using Chrome DevTools."
  },
  {
    "id": "wd-009",
    "title": "Intro to Web Accessibility",
    "domain": "web_development",
    "level": "beginner",
    "type": "course",
    "tags": [
      "accessibility",
      "a11y"
    ],
    "prerequisites": [
      "wd-001"
    ],
    "duration_hours": 3,
    "url": "https://web.dev/learn/accessibility/",
    "description": "Build usable interfaces for everyone: semantic HTML, ARIA basics, and keyboard navigation."
  },
  {
    "id": "wd-010",
    "title": "Full Stack Web Dev Roadmap",
    "domain": "web_development",
    "level": "beginner",
    "type": "article",
    "tags": [
      "roadmap",
      "overview"
    ],
    "prerequisites": [],
    "duration_hours": 1,
    "url": "https://roadmap.sh/full-stack",
    "description": "A visual overview of the full-stack developer learning path from basics to advanced."
  },
  {
    "id": "wd-011",
    "title": "Personal Portfolio Site (Project)",
    "domain": "web_development",
    "level": "beginner",
    "type": "project",
    "tags": [
      "html",
      "css",
      "project"
    ],
    "prerequisites": [
      "wd-004"
    ],
    "duration_hours": 6,
    "url": "https://www.freecodecamp.org/learn/responsive-web-design/#front-end-development-libraries-projects",
    "description": "Build and deploy a responsive personal portfolio site using HTML and CSS."
  },
  {
    "id": "wd-012",
    "title": "Web Dev Foundations Assessment",
    "domain": "web_development",
    "level": "beginner",
    "type": "assessment",
    "tags": [
      "assessment",
      "html",
      "css",
      "javascript"
    ],
    "prerequisites": [
      "wd-006"
    ],
    "duration_hours": 1,
    "url": "https://www.freecodecamp.org/learn/javascript-algorithms-and-data-structures/",
    "description": "Quiz covering HTML, CSS, and core JavaScript to confirm you're ready for intermediate topics."
  },
  {
    "id": "wd-013",
    "title": "Modern JavaScript (ES6+)",
    "domain": "web_development",
    "level": "intermediate",
    "type": "course",
    "tags": [
      "javascript",
      "es6"
    ],
    "prerequisites": [
      "wd-006"
    ],
    "duration_hours": 6,
    "url": "https://javascript.info/",
    "description": "Arrow functions, destructuring, modules, classes, and other modern JS features."
  },
  {
    "id": "wd-014",
    "title": "Asynchronous JavaScript",
    "domain": "web_development",
    "level": "intermediate",
    "type": "course",
    "tags": [
      "javascript",
      "async",
      "promises"
    ],
    "prerequisites": [
      "wd-013"
    ],
    "duration_hours": 5,
    "url": "https://javascript.info/async",
    "description": "Callbacks, Promises, and async/await for handling asynchronous operations."
  },
  {
    "id": "wd-015",
    "title": "Working with the Fetch API",
    "domain": "web_development",
    "level": "intermediate",
    "type": "article",
    "tags": [
      "javascript",
      "api",
      "http"
    ],
    "prerequisites": [
      "wd-014"
    ],
    "duration_hours": 2,
    "url": "https://developer.mozilla.org/en-US/docs/Web/API/Fetch_API/Using_Fetch",
    "description": "Make HTTP requests from the browser and handle JSON responses with fetch()."
  },
  {
    "id": "wd-016",
    "title": "npm and Build Tools",
    "domain": "web_development",
    "level": "intermediate",
    "type": "article",
    "tags": [
      "npm",
      "tooling",
      "bundlers"
    ],
    "prerequisites": [
      "wd-013"
    ],
    "duration_hours": 3,
    "url": "https://docs.npmjs.com/about-npm",
    "description": "Package management, scripts, and an introduction to modern JS bundlers like Vite."
  },
  {
    "id": "wd-017",
    "title": "TypeScript Fundamentals",
    "domain": "web_development",
    "level": "intermediate",
    "type": "course",
    "tags": [
      "typescript"
    ],
    "prerequisites": [
      "wd-013"
    ],
    "duration_hours": 6,
    "url": "https://www.typescriptlang.org/docs/handbook/intro.html",
    "description": "Add static typing to JavaScript: interfaces, generics, and type inference."
  },
  {
    "id": "wd-018",
    "title": "React Basics",
    "domain": "web_development",
    "level": "intermediate",
    "type": "course",
    "tags": [
      "react",
      "frontend"
    ],
    "prerequisites": [
      "wd-015",
      "wd-016"
    ],
    "duration_hours": 8,
    "url": "https://react.dev/learn",
    "description": "Components, JSX, props, and rendering \u2014 the foundation of building UIs with React."
  },
  {
    "id": "wd-019",
    "title": "React Hooks",
    "domain": "web_development",
    "level": "intermediate",
    "type": "course",
    "tags": [
      "react",
      "hooks"
    ],
    "prerequisites": [
      "wd-018"
    ],
    "duration_hours": 5,
    "url": "https://react.dev/reference/react",
    "description": "useState, useEffect, and custom hooks for managing state and side effects."
  },
  {
    "id": "wd-020",
    "title": "State Management with Context API",
    "domain": "web_development",
    "level": "intermediate",
    "type": "course",
    "tags": [
      "react",
      "state-management"
    ],
    "prerequisites": [
      "wd-019"
    ],
    "duration_hours": 4,
    "url": "https://react.dev/learn/passing-data-deeply-with-context",
    "description": "Share state across components without prop drilling using React Context."
  },
  {
    "id": "wd-021",
    "title": "Tailwind CSS",
    "domain": "web_development",
    "level": "intermediate",
    "type": "course",
    "tags": [
      "css",
      "tailwind",
      "styling"
    ],
    "prerequisites": [
      "wd-003"
    ],
    "duration_hours": 4,
    "url": "https://tailwindcss.com/docs/installation",
    "description": "Utility-first CSS framework for building custom designs quickly."
  },
  {
    "id": "wd-022",
    "title": "Node.js Fundamentals",
    "domain": "web_development",
    "level": "intermediate",
    "type": "course",
    "tags": [
      "nodejs",
      "backend"
    ],
    "prerequisites": [
      "wd-013"
    ],
    "duration_hours": 6,
    "url": "https://nodejs.org/en/docs",
    "description": "Run JavaScript outside the browser: modules, the file system, and the event loop."
  },
  {
    "id": "wd-023",
    "title": "Express.js and REST APIs",
    "domain": "web_development",
    "level": "intermediate",
    "type": "course",
    "tags": [
      "nodejs",